scenario,example_route,study_length,tuition_planning_band,living_and_setup_band,total_planning_band,scholarship_assumption,debt_guardrail,decision_rule,major_uncertainties,source_basis,last_verified
"A - Full funding","GOI-IES Ireland; Chevening/Commonwealth eligible UK; Knight-Hennessy Stanford","1-3 years","Full tuition covered under specific award terms","Stipend may cover most ordinary living but startup cash and exclusions remain","Personal buffer for visa travel deposits timing gaps and non-covered costs","Confirmed full award only; nomination is not funding","Avoid education loan beyond documented award gaps and emergency buffer","Proceed only after written award terms and visa maintenance funds are reconciled","Award exclusions dependent support delayed stipend housing inflation","Official scholarship pages in mba_scholarships.csv","2026-07-12"
"B - Low-cost Germany public","FAU/Passau/HWR/Schmalkalden if prerequisite-eligible","18-24 months","EUR 0-8k total typical planning range; TUM-style charged programs can be EUR 16k+","EUR 24k-36k","EUR 25k-45k for no/low-tuition route; more for Munich/TUM","No scholarship required for base case; partial aid is upside","Prefer family savings plus small bounded loan; preserve 10-15% contingency","Best financial backup if official prerequisite audit passes and German-language plan is credible","Semester fees blocked-account requirement housing city costs health insurance tuition exceptions","Official program pages; Make it in Germany; fees must be reverified","2026-07-12"
"C - Ireland balanced","Galway/UCD/Trinity analytics","12 months","EUR 21k-27k","EUR 16k-24k","EUR 38k-52k","Model no scholarship; GOI-IES/full waiver is upside","Loan should remain serviceable on conservative India-return income without assuming Irish job","Proceed if funding covers full cost plus buffer and at least one lower-cost offer remains","Dublin housing visa proof insurance fee inflation graduate employment","Official 2026/27 university fee pages and Irish immigration source","2026-07-12"
"D - Netherlands balanced","RSM Business Information Management","12 months","About EUR 26k current non-EEA snapshot","EUR 16k-24k","EUR 43k-52k","Model no scholarship; RSM award reduces tuition if won","Do not rely on student work; housing deposit and contingency ring-fenced","Proceed if capped-program admission housing plan and orientation-year strategy all hold","Housing shortage tuition inflation scholarship scarcity","Official RSM program/fees and Government.nl orientation-year source","2026-07-12"
"E - Elite France private","HEC/INSEAD/ESSEC MiM","14-24 months","EUR 35k-60k+","EUR 22k-40k","EUR 60k-100k+","Require major school/Eiffel support or strong family funding","Avoid large unsecured debt for general-management degree without placement and French-language readiness","Proceed only with major aid confirmed or family-funded ceiling plus B1/B2 French plan","School tuition Paris cost internship timing Eiffel does not generally cover private program costs","Official school and Campus France pages","2026-07-12"
"F - Elite UK one-year","Imperial/Warwick/LBS","12-16 months","GBP 38k-50k+","GBP 18k-28k","GBP 56k-78k+","Major scholarship preferred; model zero aid until award letter","Do not justify debt using 18-month Graduate route alone","Proceed only when worst-case funding is complete and India-return repayment remains acceptable","GBP/INR movement London housing shortened Graduate route job market","Official school fee pages and GOV.UK Graduate rules","2026-07-12"
"G - Singapore premium","NUS MSBA","About 13 months","SGD 85k current AY2026/27 international fee","SGD 25k-35k","SGD 110k-125k","Major BAC scholarship required unless family ceiling is high","No automatic post-study work route means debt case must not assume Singapore employment","Dream application only; enrol only with major aid or strong non-debt funding","Fee changes living cost work-pass salary/COMPASS employment","Official NUS MSBA and Singapore MOM pages","2026-07-12"
"H - US analytics premium","MIT MBAn/Duke MQM","10-12 months","USD 72k-97k net/list snapshot depending program offsets; verify","USD 30k-45k","USD 105k-140k+","Major fellowship required for affordability; capstone offset is not full funding","No large unsecured loan based on OPT/H-1B hope; test India-return repayment stress","Apply as Dream only; enrol after written aid and full cost-of-attendance review","Health insurance exchange rate OPT/STEM designation sponsorship and living cost","Official MIT/Duke fee pages and USCIS OPT source","2026-07-12"
