business_name,city,sector,website_or_social,public_phone_email,likely_software_pain,possible_offer,estimated_project_value_inr,ease_of_approach,risk,priority_score,notes
Government of India Press Coimbatore,Coimbatore,printing,https://dop.nic.in/,"public procurement/contact path only",legacy production and job tracking,Not first outreach target; study workflows for portfolio positioning,0,low,high,40,Government buyer; useful for domain learning rather than quick income
ITC Paperboards and Specialty Papers,Coimbatore,paper/packaging,https://www.itcpspd.com/,"website contact path",enterprise production reporting and vendor workflows,Dashboard/reporting internship or vendor-side analytics pitch,50000-200000,low,high,45,Large enterprise; approach only through referrals or internships
Sivakasi printing cluster,Sivakasi,printing/packaging,https://virudhunagar.nic.in/,"cluster/contact via associations",manual job cards inventory dispatch and costing,Printing press mini ERP demo with estimate-to-dispatch flow,15000-80000,medium,medium,88,Sivakasi has hundreds of registered printing units; best niche fit
Sivakasi fireworks/label suppliers,Sivakasi,printing/packaging,https://sivakasiweekly.com/,"directory/social discovery",seasonal order tracking label stock and dispatch,Order tracker plus WhatsApp status updates,10000-50000,medium,medium,82,Use public directories and expo contacts; no cold spam
Tiruppur garment exporters,Tiruppur,textile,https://www.tea-india.org/,"association contact path",style-wise order status sampling dispatch inventory,Buyer order dashboard or production follow-up CRM,25000-150000,medium,medium,84,Association route is better than random cold outreach
Nethaji Apparel Park units,Tiruppur,textile manufacturing,https://www.nethajiapparelpark.com/,"website/contact path",multi-unit order tracking and compliance docs,Internal dashboard for work orders sampling and dispatch,30000-120000,medium,medium,78,Good fit for dashboard and report-generation skills
Coimbatore pump and manufacturing MSMEs,Coimbatore,manufacturing,https://www.codissia.com/,"association contact path",manual quotations inventory service records,Quotation and service tracker with PDF exports,15000-75000,medium,medium,80,CODISSIA ecosystem can provide warmer referrals
Coimbatore hardware wholesalers,Coimbatore,hardware/wholesale,Google Maps/public listings,"public listing only",stock ledger credit follow-up GST invoice chaos,Inventory plus customer credit dashboard,10000-50000,high,medium,76,Fastest first-money category if approached through known contacts
Madurai printing presses,Madurai,printing,Google Maps/public listings,"public listing only",job estimate repeat orders delivery status,Printing estimate calculator plus order board,10000-60000,medium,medium,74,Use your Printing Press ERP as demo
Chennai packaging converters,Chennai,packaging,https://www.indiamart.com/,"public marketplace path",quote approvals inventory reels production status,Quote-to-production tracker,25000-150000,medium,medium,72,Higher budgets but more competition
Erode textile wholesalers,Erode,textile/wholesale,Google Maps/public listings,"public listing only",stock aging collections customer ledger,Stock aging and payment reminder dashboard,10000-50000,high,medium,75,Simple dashboards can sell if demo is Tamil/local-language friendly
Salem steel/hardware traders,Salem,hardware/manufacturing,Google Maps/public listings,"public listing only",quotation revisions delivery follow-up,Quotation PDF and follow-up CRM,10000-40000,high,medium,70,Good for small automation packages
Local schools near Coimbatore,Coimbatore,education,school websites/public listings,"public listing only",attendance fee reminders report cards,Attendance/report generator,10000-50000,medium,medium,68,Longer decision cycle; approach through referrals
Clinics and small hospitals,Coimbatore/Madurai,healthcare,clinic websites/public listings,"public listing only",appointments billing reports follow-up,Appointment and billing dashboard,15000-60000,medium,high,62,Privacy and reliability risk; avoid patient-data complexity early
Curtain wallpaper furniture stores,Coimbatore/Sivakasi/Chennai,retail/interiors,Google Maps/Instagram,"public listing only",measurement-based quoting catalog follow-up,Estimator plus proposal PDF generator,8000-40000,high,low,86,Strong fit because you already built calculators
Wedding card and invitation studios,Sivakasi/Madurai/Coimbatore,printing/retail,Instagram/public listings,"public listing only",proof approvals revisions order status,Proof approval portal plus WhatsApp status text templates,8000-35000,high,low,87,Very strong fit with Wedding Card Studio
Logistics vendors,Tiruppur/Coimbatore,logistics,public listings,"public listing only",parcel status POD billing reconciliation,Dispatch tracker with POD upload,15000-70000,medium,medium,71,Good add-on to textile/printing clients
Small colleges and departments,Coimbatore,education,official websites,"public contact path",event registration certificates attendance,Certificate/report automation,5000-25000,high,low,73,Fast pilot path through campus ecosystem
